{
  "active": false,
  "approval": {
    "approved_at": null,
    "authorization_maximum_age_seconds": 300,
    "first_start_approved": false,
    "fresh_server_evidence_present": false,
    "mutation_approved": false,
    "mutation_approved_at": null,
    "no_swap_risk_accepted": false,
    "operator_sync_approved": false,
    "separate_first_start_authorization_required": true,
    "server_contact_approved": false,
    "server_contact_approved_at": null,
    "source_observed_at": null,
    "source_sha": null,
    "source_tree_sha": null,
    "sync_approved": false
  },
  "authorization_conditions": {
    "authorization_must_follow_evidence": true,
    "evidence_maximum_age_seconds": 300,
    "first_start_must_remain_closed": true,
    "fresh_evidence_required": true,
    "ignored_inventory_must_match": true,
    "no_collision_required": true,
    "operator_approval_required": true,
    "product_activation_must_remain_closed": true,
    "source_must_be_ancestor": true,
    "target_must_match": true,
    "tracked_clean_required": true,
    "unit_and_never_started_boundary_required": true
  },
  "blockers": [
    "FIRST_START_AUTHORIZATION_CONTRACT_NOT_FINALIZED",
    "FIRST_START_NOT_APPROVED",
    "FRESH_PRESTART_NOT_EXECUTED",
    "FRESH_PRESTART_REVALIDATION_REQUIRED",
    "FRESH_SERVER_SOURCE_REVALIDATION_REQUIRED",
    "NO_SWAP_RISK_NOT_ACCEPTED_FOR_FIRST_START",
    "SERVER_CONTACT_NOT_APPROVED",
    "SERVER_CONTROL_MUTATION_NOT_APPROVED",
    "SERVER_CONTROL_SYNC_NOT_APPROVED",
    "SERVER_CONTROL_SYNC_NOT_EXECUTED"
  ],
  "contract_path": "manifests/adult-publishing-commercial-post-merge-sync-authorization.m4-29.json",
  "contract_version": "tu1nz-commercial-post-merge-sync-authorization-m4.29-v1",
  "decision": "NO_GO",
  "environment": "STAGING-S0-COMMERCIAL-CANDIDATE",
  "expected_historical_source": {
    "branch": "control-main",
    "checkout_path": "/opt/tu1nz_repos/control",
    "observed_at": "2026-08-28T19:13:59Z",
    "sha": "132d971dca214dcfa1cf2e3d48fbec172751e937",
    "tree_sha": "c50ce73098d344763fd29f12ba077fb24139b38c"
  },
  "fresh_observed_server_source": {
    "branch": null,
    "checkout_path": null,
    "observed_at": null,
    "origin_control_main_sha": null,
    "present": false,
    "sha": null,
    "tree_sha": null
  },
  "historical_binding": {
    "m4_24_contract_sha256": "bf43aee420e133b9e5167a90c2e4c260d2716c0390c8cfc439fb1d03c1b87da3",
    "m4_25_contract_sha256": "b5ceaff212c8f10529b2c89a2667dd0ef715db5e361a2dcd05007074cbd61ee2",
    "m4_26_contract_sha256": "47c5bca41e2b09e210fb61ab9de31d0ab1e44edf6715a2bc561619fcda4e3d59",
    "m4_27_contract_sha256": "d2333ae8fcd623bb778e9bf1a780ec209b58577c0b2b14336186217784b84a46",
    "m4_28_contract_sha256": "d74acaf3a07b43f05e9abcbe380626a7a1301281e2c388028a7be7d760ecb6b6"
  },
  "ignored_baseline": {
    "entries": [
      ".r28r4-control-payload-clean.tar.gz",
      "_filelist_reference.txt",
      "_filelist_reference.txt.bak_20260215T082155Z",
      "analysis/n8n_fix_2026-03-18/",
      "analysis/n8n_perms_2026-03-18/",
      "analysis/security_incident_2026-08-25/",
      "checksums.txt",
      "checksums_current.txt",
      "checksums_reference.sha256",
      "checksums_reference.txt",
      "emoji_map.sed",
      "integrity_baseline.sha256",
      "integrity_reference.sha256",
      "integrity_reference.txt",
      "last_sync.ok",
      "legacy_units/",
      "monitor_last.txt",
      "nginx/validation.pid",
      "rebaseline_2026/",
      "scripts/__pycache__/",
      "scripts/encrypted_drive_backup",
      "systemd/tu1nz-git-sync.service",
      "systemd/tu1nz-git-sync.timer"
    ],
    "entries_count": 23,
    "entries_sha256": "b23591e86c2b43fbc11a376eb3d0a68c19e3979b1538aa4ac50711b598300e89",
    "recursive_inventory_algorithm": "sha256-canonical-path-mode-owner-group-size-content-or-link-target-v1"
  },
  "mutation_ready_conditions": {
    "authorization_drift_check_required": true,
    "candidate_never_started_recheck_required": true,
    "ignored_inventory_recheck_required": true,
    "mutation_requires_separate_approval": true,
    "rollback_ref_required": true,
    "root_private_evidence_directory_required": true,
    "source_drift_check_required": true,
    "target_drift_check_required": true,
    "verified_bundle_required": true
  },
  "post_merge_target": {
    "branch": "control-main",
    "merge_commit": true,
    "merge_parents": [
      "7710acfbadb50ca7a143d6dce84c6556ddf9cb84",
      "38ae8008f4923cdfedaaa77bff074f9ba81fb6ad"
    ],
    "post_merge_ci_run_id": 33207033378,
    "pull_request": 37,
    "repository": "Tausendunde1nz/infra",
    "sha": "2c17ae00d9c9b6e057ba36a1766166f7f5549d4c",
    "tree_sha": "c9408b89f994f1f2fc6f57709bebfb11b767209b"
  },
  "product_boundary": {
    "external_providers_enabled": false,
    "first_start_authorized": false,
    "network_enabled": false,
    "publishing_enabled": false,
    "real_media_enabled": false,
    "real_payment_enabled": false,
    "synthetic_data_only": true,
    "telegram_intake_enabled": false
  },
  "read_only_server_evidence": {
    "capture_status": "NOT_EXECUTED",
    "evidence_version": "tu1nz-m4.29-read-only-server-evidence-v1",
    "read_error_is_failure": true,
    "required_checks": [
      "APPLICATION_AND_INSTALLED_CONTROL_BINDINGS",
      "CANDIDATE_NEVER_STARTED",
      "CHECKOUT_MUTATORS_ABSENT",
      "CONTROL_MAIN_BRANCH",
      "FAST_FORWARD_ANCESTRY_TO_TARGET",
      "GIT_INTEGRITY",
      "HISTORICAL_CONTRACT_BINDINGS",
      "HOSTNAME_AND_TAILSCALE_IDENTITY",
      "IGNORED_23_TOP_LEVEL_ENTRIES",
      "IGNORED_RECURSIVE_INVENTORY",
      "INCOMING_TRACKED_COLLISIONS_ABSENT",
      "MANIFEST_STATE_BACKUP_RESTORE_BINDINGS",
      "ORIGIN_CONTROL_MAIN",
      "SERVER_CONTROL_HEAD_SHA_TREE",
      "TRACKED_CLEAN",
      "UNIT_INACTIVE_DEAD_STATIC",
      "UNIT_JOURNAL_EMPTY",
      "UNIT_NRESTARTS_ZERO",
      "UNIT_RESTART_NO",
      "UNIT_RUNTIME_MAX_180",
      "UNIT_RUNTIME_STATUS_AND_LOCK_ABSENT",
      "UNIT_START_TIMESTAMPS_ABSENT"
    ],
    "secrets_must_not_be_captured": true,
    "server_contact_approved": false
  },
  "release_binding": {
    "application_sha": "52494d6121660ead53774deb8616701f14bb7a8f",
    "application_tree_sha": "b2820945c52ffdf77c2f5fbdd227c03ee6b245ab",
    "archive_inventory_sha256": "f7dd1b3fea220bc1ef032325edc9bb8033d79f2c52e5893927d93018f3d4aec3",
    "archive_name": "tu1nz_system_backup_20260828T18-15-58Z.tar.gz",
    "archive_sha256": "f892758dccf2157b4fa11afa38fe61dfcd36f18076230a76f1d23627bf18afc0",
    "installed_control_sha": "3135197ba4ac577bbb7fd28341d0c2dc845a7ebe",
    "installed_control_tree_sha": "da01c5bacb883442e0b556d5e291c8b8206959a2",
    "manifest_sha256": "68d8e276b2e0442cc9e02937264c6f493e938f7ab0fc3372239dba69a05a6386",
    "restore_evidence_sha256": "013e89b92fda435f978960bb417cf2a7c6da93e6bc5387612b648a2358220b7d",
    "state_sha256": "8311a0072ab0e8165d21256e0edb6980bfc1e2acf7abe97b226cfc979545fd12",
    "unit_sha256": "ff631c7722daf4bd1f1fd9f6a61a1008e10b67f7a683603bec834ecad8722e4d"
  },
  "rollback": {
    "evidence_must_be_preserved": true,
    "git_clean_forbidden": true,
    "ignored_material_must_be_preserved": true,
    "restore_previous_source_ref_and_tracked_tree_only": true,
    "service_database_release_mutation_forbidden": true,
    "status": "PLANNED_NOT_AUTHORIZED"
  },
  "sprint": "M4.29",
  "sync_transaction": {
    "allowed_checkout": "/opt/tu1nz_repos/control",
    "allowed_mutation": "FAST_FORWARD_CONTROL_MAIN_TO_EXACT_TARGET_ONLY",
    "fast_forward_only": true,
    "forbidden_operations": [
      "CHECKOUT_OTHER_BRANCH",
      "DAEMON_RELOAD",
      "DATABASE_CHANGE",
      "FIRST_START",
      "FORCE",
      "GIT_CLEAN",
      "HARD_RESET",
      "PROVIDER_ACCESS",
      "PULL",
      "REBASE",
      "RELEASE_LINK_CHANGE",
      "STATE_CHANGE",
      "UNIT_ACTION"
    ],
    "mutation_scope": [
      "/opt/tu1nz_repos/control/.git",
      "/opt/tu1nz_repos/control tracked worktree"
    ],
    "status": "NOT_EXECUTED"
  }
}
